{
  "schema_version": "1.0.0",
  "document_id": "DOC-AMANA-ASXS6-PARTS-RP-A4353",
  "source_id": "ecmdi_manual_document_copy",
  "title": "ASXS6S Side Discharge Split System Condenser Unit Repair Parts",
  "document_type": "parts_catalog",
  "document_number": "RP-A4353",
  "document_revision": "January 2023",
  "published_date": null,
  "language": "en",
  "source_url": "https://resource.ecmdi.com/is/content/Watscocom/Gemaire/amana_asxs6_en_pl.pdf",
  "applicability": {
    "manufacturer_ids": ["daikin_comfort_technologies"],
    "brand_ids": ["amana"],
    "family_ids": ["amana_asxs6_s_series"],
    "model_ids": ["ASXS6S4810AA"],
    "revision_ids": ["AA"],
    "serial_ranges": [],
    "notes": "The cover explicitly lists ASXS6S4810AA. Individual parts must still be checked against the expanded model nomenclature."
  },
  "fingerprint": {
    "sha256": "27a2438ed273231bc9a7d14c22e2b66bee962f6a763db6f6194120a974b5c967",
    "file_size_bytes": 1780277,
    "mime_type": "application/pdf",
    "page_count": 13,
    "duplicate_of_document_id": null,
    "ocr_required": false
  },
  "acquisition": {
    "discovered_at": "2026-08-02T15:55:03Z",
    "downloaded_at": null,
    "method": "MANUAL_UPLOAD",
    "http_status": null,
    "final_url": "https://resource.ecmdi.com/is/content/Watscocom/Gemaire/amana_asxs6_en_pl.pdf",
    "audit_event_id": "AUDIT-IMPORT-20260802-002"
  },
  "provenance": [
    {
      "fact_id": "FACT-DOC-RP-A4353-IDENTITY",
      "entity_id": "DOC-AMANA-ASXS6-PARTS-RP-A4353",
      "property": "/document_identity",
      "value": {
        "document_number": "RP-A4353",
        "revision": "January 2023",
        "model": "ASXS6S4810AA"
      },
      "unit": null,
      "source": {
        "document_id": "DOC-AMANA-ASXS6-PARTS-RP-A4353",
        "document_title": "ASXS6S Side Discharge Split System Condenser Unit Repair Parts",
        "page": 1,
        "section": "Cover",
        "source_url": "https://resource.ecmdi.com/is/content/Watscocom/Gemaire/amana_asxs6_en_pl.pdf",
        "document_revision": "January 2023"
      },
      "extraction": {
        "method": "MANUAL_ENTRY",
        "confidence": 1.0,
        "extracted_at": "2026-08-02T15:55:03Z",
        "provider": null,
        "model_version": null,
        "prompt_version": null,
        "run_id": "RUN-MANUAL-IMPORT-20260802-001"
      },
      "validation": {
        "level": "LEVEL_2_SOURCE_VISIBLE",
        "outcome": "ACCEPTED",
        "reviewed_by": "Codex PDF import verification",
        "reviewed_at": "2026-08-02T15:55:03Z",
        "notes": "Document identity only. Parts have not been extracted or reviewed."
      }
    }
  ]
}
