{
  "schema_version": "1.0.0",
  "document_id": "DOC-AMANA-ASXS6-SPEC-SS-ASXS6",
  "source_id": "daikin_public_document_cdn",
  "title": "ASXS6 Amana S-Series Product Specifications",
  "document_type": "product_specification",
  "document_number": "SS-ASXS6",
  "document_revision": "09/24",
  "published_date": null,
  "language": "en",
  "source_url": "https://cdn.daikincloud.io/PIM/Assets/Documents/SS-ASXS6.pdf",
  "applicability": {
    "manufacturer_ids": ["daikin_comfort_technologies"],
    "brand_ids": ["amana"],
    "family_ids": ["amana_asxs6_s_series"],
    "model_ids": ["ASXS6S4810AA"],
    "revision_ids": ["AA"],
    "serial_ranges": [],
    "notes": "Family document. Exact technical values must be mapped to the ASXS6S4810A* row or section before use."
  },
  "fingerprint": {
    "sha256": "d1096bba597e6f508cfc70ae6b7e55bb1fc72d97880a001a540748f007018e71",
    "file_size_bytes": 2604278,
    "mime_type": "application/pdf",
    "page_count": 56,
    "duplicate_of_document_id": null,
    "ocr_required": false
  },
  "acquisition": {
    "discovered_at": "2026-08-02T15:55:03Z",
    "downloaded_at": null,
    "method": "MANUAL_UPLOAD",
    "http_status": null,
    "final_url": "https://cdn.daikincloud.io/PIM/Assets/Documents/SS-ASXS6.pdf",
    "audit_event_id": "AUDIT-IMPORT-20260802-001"
  },
  "provenance": [
    {
      "fact_id": "FACT-DOC-SS-ASXS6-IDENTITY",
      "entity_id": "DOC-AMANA-ASXS6-SPEC-SS-ASXS6",
      "property": "/document_identity",
      "value": {
        "document_number": "SS-ASXS6",
        "revision": "09/24",
        "model_pattern": "ASXS6S4810A*"
      },
      "unit": null,
      "source": {
        "document_id": "DOC-AMANA-ASXS6-SPEC-SS-ASXS6",
        "document_title": "ASXS6 Amana S-Series Product Specifications",
        "page": 1,
        "section": "Cover and footer",
        "source_url": "https://cdn.daikincloud.io/PIM/Assets/Documents/SS-ASXS6.pdf",
        "document_revision": "09/24"
      },
      "extraction": {
        "method": "MANUAL_ENTRY",
        "confidence": 1.0,
        "extracted_at": "2026-08-02T15:55:03Z",
        "provider": null,
        "model_version": null,
        "prompt_version": null,
        "run_id": "RUN-MANUAL-IMPORT-20260802-001"
      },
      "validation": {
        "level": "LEVEL_2_SOURCE_VISIBLE",
        "outcome": "ACCEPTED",
        "reviewed_by": "Codex PDF import verification",
        "reviewed_at": "2026-08-02T15:55:03Z",
        "notes": "Document identity only. Technical facts have not been extracted or reviewed."
      }
    }
  ]
}
