{
  "schema_version": "1.0.0",
  "document_id": "DOC-AMANA-ASXS6-SERVICE-SIUS612213E",
  "source_id": "ecmdi_manual_document_copy",
  "title": "ASXS6 / ASZS6 Inverter Outdoor Units Service Instructions",
  "document_type": "service_manual",
  "document_number": "SiUS612213E",
  "document_revision": null,
  "published_date": null,
  "language": "en",
  "source_url": "https://resource.ecmdi.com/is/content/Watscocom/Gemaire/amana_asxs6_en_sm.pdf",
  "applicability": {
    "manufacturer_ids": ["daikin_comfort_technologies"],
    "brand_ids": ["amana"],
    "family_ids": ["amana_asxs6_s_series"],
    "model_ids": ["ASXS6S4810AA"],
    "revision_ids": ["AA"],
    "serial_ranges": [],
    "notes": "Family service document for ASXS6***1*A*. Each extracted fact requires exact model and section applicability review."
  },
  "fingerprint": {
    "sha256": "833512e80c2cfb7a9944b6d5cddfcaf499f8b9477445f59c12dcfd670db5846a",
    "file_size_bytes": 27379714,
    "mime_type": "application/pdf",
    "page_count": 136,
    "duplicate_of_document_id": null,
    "ocr_required": false
  },
  "acquisition": {
    "discovered_at": "2026-08-02T15:55:03Z",
    "downloaded_at": null,
    "method": "MANUAL_UPLOAD",
    "http_status": null,
    "final_url": "https://resource.ecmdi.com/is/content/Watscocom/Gemaire/amana_asxs6_en_sm.pdf",
    "audit_event_id": "AUDIT-IMPORT-20260802-003"
  },
  "provenance": [
    {
      "fact_id": "FACT-DOC-SIUS612213E-IDENTITY",
      "entity_id": "DOC-AMANA-ASXS6-SERVICE-SIUS612213E",
      "property": "/document_identity",
      "value": {
        "document_number": "SiUS612213E",
        "model_pattern": "ASXS6***1*A*",
        "refrigerant": "R-410A"
      },
      "unit": null,
      "source": {
        "document_id": "DOC-AMANA-ASXS6-SERVICE-SIUS612213E",
        "document_title": "ASXS6 / ASZS6 Inverter Outdoor Units Service Instructions",
        "page": 1,
        "section": "Cover",
        "source_url": "https://resource.ecmdi.com/is/content/Watscocom/Gemaire/amana_asxs6_en_sm.pdf",
        "document_revision": null
      },
      "extraction": {
        "method": "MANUAL_ENTRY",
        "confidence": 1.0,
        "extracted_at": "2026-08-02T15:55:03Z",
        "provider": null,
        "model_version": null,
        "prompt_version": null,
        "run_id": "RUN-MANUAL-IMPORT-20260802-001"
      },
      "validation": {
        "level": "LEVEL_2_SOURCE_VISIBLE",
        "outcome": "ACCEPTED",
        "reviewed_by": "Codex PDF import verification",
        "reviewed_at": "2026-08-02T15:55:03Z",
        "notes": "Document identity only. Service procedures and technical facts have not been extracted or reviewed."
      }
    }
  ]
}
